{
    "_id": "",
    "ori_id": "",
    "created_by": "",
    "updated_by": "",
    "created_at": "",
    "updated_at": "",
    "version": 0,
    "saved": 0,
    "latest": false,
    "active": false,
    "basic_info": {
        "item_name": "",
        "distinction": "",
        "classification": "",
        "type": "",
        "cost": 0,
        "price": 0,
        "quantity": 1,
        "file_name": "",
        "file_url": "",
        "location": "",
        "note": "",
        "check": "",
        "shop": {
            "shop_id": "",
            "shop_name": ""
        }
    },
    "components": [{
        "_id": "",
        "component_name": "",
        "volume": 0,
        "quantity": 0,
        "stock": 0,
        "demand": 0,
        "order": 0,
        "size": "",
        "note": "",
        "spec": {
            "spec_id": "",
            "spec_code": "",
            "classification_code": "",
            "code_index": 0,
            "material": "",
            "print": "",
            "processing": ""
        }
    }]
}